{
  "schema_version": "1.0.0",
  "run_id": "RUN-T1-GROUND-TRUTH",
  "information_sufficiency": "sufficient",
  "generation_allowed": true,
  "recommended_action": "proceed",
  "decision_reason": "Grounded functional and performance requirements, owner, and Q3 deadline can be documented exactly as stated. The generic user reference and Q3 date range do not require invention or prevent faithful PRD generation.",
  "gaps": [],
  "contradictions": [],
  "risks": []
}
