{
  "schema_version": "1.0.0",
  "run_id": "RUN-T2-GROUND-TRUTH",
  "information_sufficiency": "insufficient",
  "generation_allowed": false,
  "recommended_action": "request_clarification",
  "decision_reason": "The source establishes a desire for better reporting, but the reporting capability cannot be written as a testable grounded PRD requirement because the referenced Competitor X capabilities, target users, required metrics, and report presentation are all unspecified.",
  "gaps": [
    { "id": "GAP-001", "category": "metrics", "description": "Required reporting metrics are not specified, so the intended report content and success criteria cannot be represented without invention.", "severity": "high", "clarification_question": "Which metrics should the reports contain?", "related_item_ids": ["FR-001"], "source_missing_information_ids": ["MISS-001"] },
    { "id": "GAP-002", "category": "output_format", "description": "The required report format or presentation is not specified, so the expected reporting output cannot be defined testably.", "severity": "high", "clarification_question": "What report format or presentation is required?", "related_item_ids": ["FR-001"], "source_missing_information_ids": ["MISS-002"] },
    { "id": "GAP-003", "category": "users", "description": "The target users for better reporting are not identified, and the requested reporting capability is otherwise too ambiguous to preserve usable user scope.", "severity": "high", "clarification_question": "Which users need the improved reporting?", "related_item_ids": ["FR-001"], "source_missing_information_ids": ["MISS-003"] },
    { "id": "GAP-004", "category": "reference_scope", "description": "The specific Competitor X reporting capabilities intended as the reference are not identified, so the requested reporting capability remains undefined.", "severity": "high", "clarification_question": "Which specific Competitor X reporting capabilities should be used as the reference?", "related_item_ids": ["FR-001"], "source_missing_information_ids": ["MISS-004"] }
  ],
  "contradictions": [],
  "risks": []
}
