{
  "schema_version": "1.0.0",
  "run_id": "RUN-T8-GROUND-TRUTH",
  "information_sufficiency": "sufficient",
  "generation_allowed": true,
  "recommended_action": "proceed",
  "decision_reason": "Grounded functional requirements and distinct personas are stated clearly, with no material missing information, contradictions, or extracted risks.",
  "gaps": [],
  "contradictions": [],
  "risks": []
}
