{
  "schema_version": "1.0.0",
  "run_id": "RUN-T10-GROUND-TRUTH",
  "information_sufficiency": "partially_sufficient",
  "generation_allowed": true,
  "recommended_action": "proceed_with_tbd",
  "decision_reason": "The SSO login requirement and its dependency on the new auth service are grounded. The auth service ETA is explicitly unknown and can be documented as TBD without inventing a delivery date.",
  "gaps": [
    {
      "id": "GAP-001",
      "category": "dependency_eta",
      "description": "The ETA for the new auth service required for SSO login is explicitly unknown.",
      "severity": "medium",
      "clarification_question": "What is the ETA for the new auth service being built by Team Alpha?",
      "related_item_ids": [
        "DEP-001",
        "RSK-001"
      ],
      "source_missing_information_ids": []
    }
  ],
  "contradictions": [],
  "risks": [
    {
      "id": "RSK-001",
      "description": "The ETA for the new auth service is unknown.",
      "severity": "medium",
      "related_item_ids": [
        "DEP-001"
      ],
      "source_risk_ids": [
        "RSK-001"
      ]
    }
  ]
}
