{
  "schema_version": "1.0.0",
  "run_id": "RUN-T1-GROUND-TRUTH",
  "information_sufficiency": "sufficient",
  "generation_allowed": true,
  "recommended_action": "proceed",
  "decision_reason": "Grounded functional and performance requirements, an owner, and a Q3 deadline are stated. The generic user reference and unspecified calendar year for Q3 can be preserved exactly as stated without invention or resolution, so the extractor clarification records do not create material gaps.",
  "gaps": [],
  "contradictions": [],
  "risks": []
}
